{
  "$schema": "framewebforjs-screen-manifest.v1.schema.json",
  "manifestVersion": 1,
  "sourceRevision": "778c243",
  "sources": [
    "FrameWebforJS/src/app/app-routing.module.ts",
    "FrameWebforJS/src/app/app.component.html",
    "FrameWebforJS/src/app/components/menu/menu.component.html",
    "FrameWebforJS/src/app/components/optional-header/optional-header.component.html",
    "FrameWebforJS/src/app/components/input/**/*.component.ts",
    "FrameWebforJS/src/app/components/result/**/*.service.ts",
    "FrameWebforJS/src/app/components/start-menu/start-menu.component.html",
    "FrameWebforJS/src/app/components/preset/preset.component.html",
    "FrameWebforJS/src/app/components/print/**/*.component.html"
  ],
  "approvedExclusions": [
    {
      "mappingKey": "exclusion.auth.login",
      "reason": "The first desktop release has no production user authentication.",
      "approvedScope": "login"
    },
    {
      "mappingKey": "exclusion.auth.mypage",
      "reason": "MyPage is visible only after authentication, which is outside the approved first release.",
      "approvedScope": "authenticated-mypage"
    },
    {
      "mappingKey": "exclusion.auth.logout",
      "reason": "Logout is visible only after authentication, which is outside the approved first release.",
      "approvedScope": "authenticated-logout"
    }
  ],
  "shell": {
    "hierarchy": [
      { "mappingKey": "shell.header.menu", "order": 0, "kind": "HeaderMenuControl", "defaultState": "visible", "action": "host anonymous menu actions", "transition": "none" },
      { "mappingKey": "shell.header.optional", "order": 1, "kind": "OptionalHeaderControl", "defaultState": "visible", "action": "host route context controls", "transition": "route-state" },
      { "mappingKey": "shell.navigation.primary", "order": 2, "kind": "PrimaryNavigationControl", "defaultState": "expanded", "action": "navigate routes", "transition": "route-state" },
      { "mappingKey": "shell.workspace.viewport", "order": 3, "kind": "WorkspaceControl", "defaultState": "visible-full-workspace", "action": "render and select model", "transition": "viewport-state" },
      { "mappingKey": "shell.route.panel", "order": 4, "kind": "RoutePanelHostControl", "defaultState": "hidden", "action": "show movable resizable route surface", "transition": "route-open-close" },
      { "mappingKey": "shell.overlay.host", "order": 5, "kind": "OverlayHostControl", "defaultState": "hidden", "action": "show modal overlay above workspace", "transition": "overlay-state" }
    ],
    "anonymousMenu": [
      { "mappingKey": "menu.file.root", "order": 0, "kind": "dropdown", "defaultState": "visible", "action": "open file menu", "transition": "menu-open" },
      { "mappingKey": "menu.file.new", "order": 1, "kind": "button", "defaultState": "enabled", "action": "new project", "transition": "confirm-then-new" },
      { "mappingKey": "menu.file.open", "order": 2, "kind": "file-button", "defaultState": "enabled", "action": "open project", "transition": "file-picker" },
      { "mappingKey": "menu.file.save", "order": 3, "kind": "button", "defaultState": "enabled-with-document", "action": "save project", "transition": "save" },
      { "mappingKey": "menu.file.preset", "order": 4, "kind": "button", "defaultState": "enabled", "action": "open preset chooser", "transition": "overlay-preset" },
      { "mappingKey": "menu.file.overwrite", "order": 5, "kind": "button", "defaultState": "hidden", "condition": "electron", "action": "overwrite project", "transition": "save" },
      { "mappingKey": "menu.file.output", "order": 6, "kind": "button", "defaultState": "hidden", "condition": "calculated", "action": "export result data", "transition": "export" },
      { "mappingKey": "menu.file.newwindow", "order": 7, "kind": "button", "defaultState": "hidden", "condition": "electron", "action": "open another window", "transition": "new-window" },
      { "mappingKey": "menu.print", "order": 8, "kind": "button", "defaultState": "visible", "action": "open print selection", "transition": "overlay-print" },
      { "mappingKey": "menu.language", "order": 9, "kind": "dropdown", "defaultState": "ja", "action": "select ja en zh", "transition": "language-change" },
      { "mappingKey": "menu.help", "order": 10, "kind": "link", "defaultState": "visible", "action": "open operation manual", "transition": "external-link" },
      { "mappingKey": "menu.contact", "order": 11, "kind": "button", "defaultState": "visible", "action": "toggle contact chat", "transition": "chat-open" },
      { "mappingKey": "menu.auth.login", "order": 12, "kind": "button", "defaultState": "visible", "action": "login", "transition": "approved-exclusion", "disposition": "approved-exclusion" }
    ],
    "navigation": [
      { "mappingKey": "nav.calculate", "order": 0, "kind": "button", "defaultState": "enabled-with-valid-document", "action": "calculate", "transition": "wait-then-results-enabled" },
      { "mappingKey": "nav.input.elements", "order": 1, "kind": "route-button", "defaultState": "enabled", "action": "open input-elements", "transition": "InputElements" },
      { "mappingKey": "nav.input.nodes", "order": 2, "kind": "route-button", "defaultState": "enabled", "action": "open input-nodes", "transition": "InputNodes" },
      { "mappingKey": "nav.input.supports", "order": 3, "kind": "route-button", "defaultState": "enabled", "action": "open input-fix_nodes", "transition": "InputSupports" },
      { "mappingKey": "nav.input.members", "order": 4, "kind": "route-button", "defaultState": "enabled", "action": "open input-members", "transition": "InputMembers" },
      { "mappingKey": "nav.input.panel", "order": 5, "kind": "route-button", "defaultState": "visible", "condition": "3d", "action": "open input-panel", "transition": "InputPanel" },
      { "mappingKey": "nav.input.joints", "order": 6, "kind": "route-button", "defaultState": "enabled", "action": "open input-joints", "transition": "InputJoints" },
      { "mappingKey": "nav.input.notice", "order": 7, "kind": "route-button", "defaultState": "enabled", "action": "open input-notice_points", "transition": "InputNoticePoints" },
      { "mappingKey": "nav.input.springs", "order": 8, "kind": "route-button", "defaultState": "enabled", "action": "open input-fix_members", "transition": "InputMemberSprings" },
      { "mappingKey": "nav.input.loads", "order": 9, "kind": "route-button", "defaultState": "enabled", "action": "open input-load-name", "transition": "InputLoadNames" },
      { "mappingKey": "nav.input.define", "order": 10, "kind": "route-button", "defaultState": "enabled", "action": "open input-define", "transition": "InputDefine" },
      { "mappingKey": "nav.result.displacement", "order": 11, "kind": "route-button", "defaultState": "disabled", "condition": "calculated", "action": "open displacement results", "transition": "ResultBasicDisplacements" },
      { "mappingKey": "nav.result.reaction", "order": 12, "kind": "route-button", "defaultState": "disabled", "condition": "calculated", "action": "open reaction results", "transition": "ResultBasicReactions" },
      { "mappingKey": "nav.result.sectionforce", "order": 13, "kind": "route-button", "defaultState": "disabled", "condition": "calculated", "action": "open section-force results", "transition": "ResultBasicSectionForces" }
    ],
    "optionalHeaderStates": [
      { "mappingKey": "header.dimension", "order": 0, "kind": "segmented-2d-3d", "defaultState": "2d", "action": "set dimension", "transition": "dimension-state" },
      { "mappingKey": "header.load", "order": 1, "kind": "segmented-load-name-strength", "defaultState": "load-name", "condition": "load-route", "action": "switch load subroute", "transition": "InputLoadNames-or-InputLoads" },
      { "mappingKey": "header.define", "order": 2, "kind": "segmented-define-combine-pickup", "defaultState": "define", "condition": "derived-input-route", "action": "switch derived subroute", "transition": "InputDefine-or-InputCombine-or-InputPickup" },
      { "mappingKey": "header.result", "order": 3, "kind": "segmented-basic-combine-pickup", "defaultState": "basic", "condition": "result-route", "action": "switch result subroute", "transition": "result-substate" },
      { "mappingKey": "header.pager", "order": 4, "kind": "previous-select-next", "defaultState": "first-page", "condition": "paged-route", "action": "change page", "transition": "route-page" },
      { "mappingKey": "header.direction", "order": 5, "kind": "previous-select-next", "defaultState": "first-direction", "condition": "combine-or-pickup-result", "action": "change result direction", "transition": "result-direction" },
      { "mappingKey": "header.member", "order": 6, "kind": "members-rigid-zone-select", "defaultState": "members", "condition": "member-route", "action": "switch member subroute", "transition": "InputMembers-or-InputRigidZone" },
      { "mappingKey": "header.control", "order": 7, "kind": "toggle", "defaultState": "closed", "action": "toggle viewport controls", "transition": "control-panel" }
    ]
  },
  "routes": [
    {
      "mappingKey": "route.input.elements", "family": "input", "angularRoute": "input-elements", "angularComponent": "InputElementsComponent", "csharpRouteId": "InputElements", "navigationKey": "nav.input.elements", "defaultPanelVisible": false,
      "tableKeys": ["Sections", "ElementPropertySets", "ModelSettings"],
      "fields": [
        { "mappingKey": "route.input.elements.field.e", "key": "E", "order": 0, "group": "elastic", "kind": "number", "defaultValue": null, "readOnly": false, "visibleWhen": "always", "csharpTableKey": "Sections", "csharpColumnId": "e" },
        { "mappingKey": "route.input.elements.field.g", "key": "G", "order": 1, "group": "shear-elastic", "kind": "number", "defaultValue": null, "readOnly": false, "visibleWhen": "3d", "csharpTableKey": "Sections", "csharpColumnId": "g" },